郵遞區號,電腦局號,郵務局號,局名,電腦局名,縣市,鄉鎮市區,地址,完整地址,緯度,經度
27044,011122-6,260022,蘇澳蘇西里郵局,宜蘭22支,宜蘭縣,蘇澳鎮,中山路1段253號,宜蘭縣蘇澳鎮中山路1段253號,24.595537,121.844004
27291,011123-0,260023,蘇澳東澳路郵局,宜蘭23支,宜蘭縣,南澳鄉,蘇花路3段171號,宜蘭縣南澳鄉蘇花路3段171號,24.519709,121.832399
27241,011124-3,260024,南澳郵局,宜蘭24支,宜蘭縣,南澳鄉,蘇花路2段351號,宜蘭縣南澳鄉蘇花路2段351號,24.465357,121.802872
26541,011125-7,260025,羅東郵局,宜蘭25支,宜蘭縣,羅東鎮,興東路69號,宜蘭縣羅東鎮興東路69號,24.6775,121.768221
26847,011126-1,260026,五結二結郵局,宜蘭26支,宜蘭縣,五結鄉,二結路27號,宜蘭縣五結鄉二結路27號,24.702866,121.768003
26946,011127-4,260027,冬山郵局,宜蘭27支,宜蘭縣,冬山鄉,冬山路177號,宜蘭縣冬山鄉冬山路177號,24.634438,121.791597
26546,011128-8,260028,羅東南門郵局,宜蘭28支,宜蘭縣,羅東鎮,中正南路102號,宜蘭縣羅東鎮中正南路102號,24.670122,121.771648
26550,011129-1,260029,羅東大同路郵局,宜蘭29支,宜蘭縣,羅東鎮,大同路44-6號,宜蘭縣羅東鎮大同路44-6號,24.679666,121.773635
26845,011130-3,260030,五結郵局,宜蘭30支,宜蘭縣,五結鄉,自強路165、167號,宜蘭縣五結鄉自強路165、167號,24.683783,121.795103
26942,011131-7,260031,冬山群英郵局,宜蘭31支,宜蘭縣,冬山鄉,義成路3段482號,宜蘭縣冬山鄉義成路3段482號,24.667077,121.768077
26841,011132-1,260032,五結利澤郵局,宜蘭32支,宜蘭縣,五結鄉,利成路2段468號,宜蘭縣五結鄉利成路2段468號,24.667774,121.822058
26544,011133-4,260033,羅東西門郵局,宜蘭33支,宜蘭縣,羅東鎮,中山路4段235號,宜蘭縣羅東鎮中山路4段235號,24.67302,121.758389
26562,011134-8,260034,羅東竹林郵局,宜蘭34支,宜蘭縣,羅東鎮,復興路2段193號,宜蘭縣羅東鎮復興路2段193號,24.689406,121.764991
26641,011135-1,260035,三星郵局,宜蘭35支,宜蘭縣,三星鄉,太平路134號,宜蘭縣三星鄉太平路134號,24.666605,121.652492
26741,011136-5,260036,大同郵局,宜蘭36支,宜蘭縣,大同鄉,崙埤村泰雅路1段58號,宜蘭縣大同鄉崙埤村泰雅路1段58號,24.675797,121.609769
33043,012100-6,330000,桃園成功路郵局,桃園901支,桃園市,桃園區,成功路一段51號,桃園市桃園區成功路一段51號,24.992567,121.311098
33379,012101-0,330001,龜山大崗郵局,桃園1支,桃園市,龜山區,大崗里新興街99號,桃園市龜山區大崗里新興街99號,25.050722,121.357511
33450,012102-3,330002,八德大湳郵局,桃園2支,桃園市,八德區,介壽路一段842號,桃園市八德區介壽路一段842號,24.961527,121.299549
33451,012103-7,330003,八德郵局,桃園3支,桃園市,八德區,建國路18號,桃園市八德區建國路18號,24.931088,121.284865
33041,012104-1,330004,桃園民生路郵局,桃園4支,桃園市,桃園區,民生路246-1號,桃園市桃園區民生路246-1號,24.995275,121.312797
33343,012105-4,330005,龜山郵局,桃園5支,桃園市,龜山區,豐美街2-1號,桃園市龜山區豐美街2-1號,24.993172,121.334484
33344,012106-8,330006,龜山民安街郵局,桃園6支,桃園市,龜山區,民安街120號,桃園市龜山區民安街120號,24.989855,121.324636
33058,012107-1,330007,桃園南門郵局,桃園7支,桃園市,桃園區,中山路362號,桃園市桃園區中山路362號,24.993011,121.304575
33068,012108-5,330008,桃園大樹林郵局,桃園8支,桃園市,桃園區,大誠路9號,桃園市桃園區大誠路9號,24.983832,121.322274
33858,012109-9,330009,蘆竹郵局,桃園9支,桃園市,蘆竹區,南山路一段105號,桃園市蘆竹區南山路一段105號,25.055956,121.290577
33057,012110-1,330010,桃園茄苳郵局,桃園10支,桃園市,桃園區,龍安街12號,桃園市桃園區龍安街12號,24.987452,121.282012
33043,012111-4,330011,桃園東埔郵局,桃園11支,桃園市,桃園區,中正二街15號,桃園市桃園區中正二街15號,25.001532,121.307739
33059,012112-8,330012,桃園中路郵局,桃園12支,桃園市,桃園區,壽昌街20巷27-1號及27-2號,桃園市桃園區壽昌街20巷27-1號及27-2號,24.989912,121.292904
33051,012113-1,330013,桃園水汴頭郵局,桃園13支,桃園市,桃園區,春日路1360號,桃園市桃園區春日路1360號,25.027054,121.305892
33062,012114-5,330014,桃園福林郵局,桃園14支,桃園市,桃園區,介壽路316及316-1號,桃園市桃園區介壽路316及316-1號,24.981328,121.306438
33059,012115-9,330015,桃園永安郵局,桃園15支,桃園市,桃園區,永安路365號,桃園市桃園區永安路365號,25.000808,121.29977
33068,012116-2,330016,桃園桃鶯郵局,桃園16支,桃園市,桃園區,桃鶯路354、356號,桃園市桃園區桃鶯路354、356號,24.978053,121.322211
33305,012117-6,330017,龜山樂善郵局,桃園17支,桃園市,龜山區,復興街5號(林口長庚醫院內),桃園市龜山區復興街5號(林口長庚醫院內),25.061579,121.366796
33447,012118-0,330018,八德更寮腳郵局,桃園18支,桃園市,八德區,介壽路2段1030號,桃園市八德區介壽路2段1030號,24.932995,121.297385
33350,012119-3,330019,龜山迴龍郵局,桃園19支,桃園市,龜山區,萬壽路1段374、376號,桃園市龜山區萬壽路1段374、376號,25.017149,121.401014
33050,012120-5,330020,桃園大業郵局,桃園20支,桃園市,桃園區,大業路1段372號,桃園市桃園區大業路1段372號,25.013488,121.312215
33053,012121-9,330021,桃園府前郵局,桃園21支,桃園市,桃園區,縣府路326、328、330號,桃園市桃園區縣府路326、328、330號,24.992796,121.300593
33455,012122-2,330022,八德高城郵局,桃園22支,桃園市,八德區,永豐路581號,桃園市八德區永豐路581號,24.97539,121.271384
33062,012123-6,330023,桃園建國郵局,桃園23支,桃園市,桃園區,建國路156-8號,桃園市桃園區建國路156-8號,24.985598,121.309725
33445,012124-0,330024,八德麻園郵局,桃園24支,桃園市,八德區,介壽路2段298號,桃園市八德區介壽路2段298號,24.949758,121.297807
33377,012125-3,330025,龜山文化郵局,桃園25支,桃園市,龜山區,文化里文昌一街102號,桃園市龜山區文化里文昌一街102號,25.057385,121.369913
33851,012126-7,330026,蘆竹山腳郵局,桃園26支,桃園市,蘆竹區,南山路3段270、272號,桃園市蘆竹區南山路3段270、272號,25.0848,121.286167
33862,012127-1,330027,蘆竹大竹郵局,桃園27支,桃園市,蘆竹區,大竹路385號,桃園市蘆竹區大竹路385號,25.020572,121.264702
33304,012128-4,330028,龜山誠園郵局,桃園28支,桃園市,龜山區,樹人路56號,桃園市龜山區樹人路56號,25.046187,121.351759
33859,012129-8,330029,蘆竹錦興郵局,桃園29支,桃園市,蘆竹區,南崁路1段190號,桃園市蘆竹區南崁路1段190號,25.053064,121.286077
33044,012130-0,330030,桃園慈文郵局,桃園30支,桃園市,桃園區,經國路280、286號,桃園市桃園區經國路280、286號,25.02201,121.30342
33741,012131-3,330031,大園郵局,桃園31支,桃園市,大園區,中山北路85號,桃園市大園區中山北路85號,25.066127,121.196903
33745,012132-7,330032,大園埔心街郵局,桃園32支,桃園市,大園區,埔心街50號,桃園市大園區埔心街50號,25.053006,121.224189
33754,012133-1,330033,大園?林郵局,桃園33支,桃園市,大園區,?林里3鄰?林路99號,桃園市大園區?林里3鄰?林路99號,25.076087,121.258071
33758,012135-8,330035,臺灣桃園國際機場郵局,桃園35支,桃園市,大園區,臺灣桃園國際機場第二 航站大廈內,桃園市大園區臺灣桃園國際機場第二 航站大廈內,25.076808,121.232189
33302,012136-1,330036,龜山長庚大學郵局,桃園36支,桃園市,龜山區,文化一路259號(長庚大學活動中心內),桃園市龜山區文化一路259號(長庚大學活動中心內),25.032733,121.391122
33557,012137-5,330037,大溪郵局,桃園37支,桃園市,大溪區,康莊路210號,桃園市大溪區康莊路210號,24.879435,121.288262
33845,012138-9,330038,蘆竹光明郵局,桃園38支,桃園市,蘆竹區,南福街187、189號,桃園市蘆竹區南福街187、189號,25.039005,121.293539
33641,012139-2,330039,復興郵局,桃園39支,桃園市,復興區,中正路62號,桃園市復興區中正路62號,24.815853,121.351322
33543,012140-4,330040,大溪僑愛郵局,桃園40支,桃園市,大溪區,介壽路42、44號,桃園市大溪區介壽路42、44號,24.922813,121.295019
33544,012141-8,330041,大溪崎頂郵局,桃園41支,桃園市,大溪區,介壽路890號,桃園市大溪區介壽路890號,24.900362,121.283753
33561,012142-1,330042,大溪員樹林郵局,桃園42支,桃園市,大溪區,齋明街1號,桃園市大溪區齋明街1號,24.885773,121.270245
33548,012143-5,330043,大溪南興郵局,桃園43支,桃園市,大溪區,仁和路2段126號,桃園市大溪區仁和路2段126號,24.903401,121.26688
32041,028100-1,320000,中壢郵局,桃園44支,桃園市,中壢區,建國路36號,桃園市中壢區建國路36號,24.955735,121.225216
32082,028101-5,320001,中壢普仁郵局,桃園45支,桃園市,中壢區,中山東路2段24號,桃園市中壢區中山東路2段24號,24.95425,121.237364
32067,028102-9,320002,中壢內壢郵局,桃園46支,桃園市,中壢區,忠勤街25號,桃園市中壢區忠勤街25號,24.974402,121.255753
32092,028103-2,320003,中壢龍東路郵局,桃園47支,桃園市,中壢區,龍東路750號,桃園市中壢區龍東路750號,24.938655,121.259386
32094,028104-6,320004,中壢龍岡郵局,桃園48支,桃園市,中壢區,龍岡路3段756號,桃園市中壢區龍岡路3段756號,24.925675,121.243602
32850,028105-0,320005,觀音新坡郵局,桃園49支,桃園市,觀音區,大同里新華路2段596號,桃園市觀音區大同里新華路2段596號,25.011179,121.137494
32446,028106-3,320006,平鎮廣明郵局,桃園50支,桃園市,平鎮區,廣明路71.73號1樓,桃園市平鎮區廣明路71.73號1樓,24.953792,121.213704
32071,028107-7,320007,中壢自立郵局,桃園51支,桃園市,中壢區,莊敬路856號1樓,桃園市中壢區莊敬路856號1樓,24.963992,121.254168
32445,028108-1,320008,平鎮郵局,桃園52支,桃園市,平鎮區,延平路2段221號,桃園市平鎮區延平路2段221號,24.945645,121.209231
32001,028109-4,320009,中央大學郵局,桃園53支,桃園市,中壢區,國立中央大學內,桃園市中壢區國立中央大學內,24.965685,121.194614
32843,028110-6,320010,觀音郵局,桃園54支,桃園市,觀音區,中山路40號,桃園市觀音區中山路40號,25.035173,121.084546
32068,028111-0,320011,中壢忠義郵局,桃園55支,桃園市,中壢區,中華路1段905、907號,桃園市中壢區中華路1段905、907號,24.966915,121.244233
32023,028112-3,320012,中原大學郵局,桃園56支,桃園市,中壢區,私立中原大學內,桃園市中壢區私立中原大學內,24.959135,121.241303
32086,028113-7,320013,中壢興國郵局,桃園57支,桃園市,中壢區,元化路2段126號,桃園市中壢區元化路2段126號,24.962817,121.219295
32472,028114-1,320014,平鎮山仔頂郵局,桃園58支,桃園市,平鎮區,中豐路山頂段296號,桃園市平鎮區中豐路山頂段296號,24.8974,121.210966
32077,028115-4,320015,中壢華勛郵局,桃園59支,桃園市,中壢區,幸福新村1號,桃園市中壢區幸福新村1號,24.955234,121.26447
32096,028116-8,320016,中壢東興郵局,桃園60支,桃園市,中壢區,龍岡路1段229號,桃園市中壢區龍岡路1段229號,24.94774,121.226083
32470,028117-1,320017,平鎮北勢郵局,桃園61支,桃園市,平鎮區,金陵路2段59號,桃園市平鎮區金陵路2段59號,24.941893,121.222922
32092,028118-5,320018,中壢仁美郵局,桃園62支,桃園市,中壢區,龍文街29號,桃園市中壢區龍文街29號,24.93553,121.255481
32063,028119-9,320019,中壢南園郵局,桃園63支,桃園市,中壢區,南園二路4號,桃園市中壢區南園二路4號,24.971944,121.238216
32073,028120-1,320020,中壢頂壢郵局,桃園64支,桃園市,中壢區,榮民路53、55號,桃園市中壢區榮民路53、55號,24.969352,121.26089
32046,028121-4,320021,中壢志廣郵局,桃園65支,桃園市,中壢區,中央西路2段271、273號,桃園市中壢區中央西路2段271、273號,24.961399,121.211641
32464,028122-8,320022,平鎮金陵郵局,桃園66支,桃園市,平鎮區,金陵路3段235-1、235-2號,桃園市平鎮區金陵路3段235-1、235-2號,24.924782,121.228008
32744,028123-1,320023,新屋永安郵局,桃園67支,桃園市,新屋區,中山西路3段222、224號,桃園市新屋區中山西路3段222、224號,24.987883,121.041112
32853,028124-5,320024,觀音工業區郵局,桃園68支,桃園市,觀音區,工業五路3號(觀音工業區管理中心內),桃園市觀音區工業五路3號(觀音工業區管理中心內),25.053121,121.118017
32748,028125-9,320025,新屋郵局,桃園69支,桃園市,新屋區,中山路279號,桃園市新屋區中山路279號,24.972529,121.104467
32070,028126-2,320026,中壢環北郵局,桃園70支,桃園市,中壢區,環北路413號,桃園市中壢區環北路413號,24.966069,121.226183
32450,028127-6,320027,平鎮高雙郵局,桃園71支,桃園市,平鎮區,高雙路181號,桃園市平鎮區高雙路181號,24.954509,121.189503
32052,028128-0,320028,中壢大崙郵局,桃園72支,桃園市,中壢區,中正路4段85、87號,桃園市中壢區中正路4段85、87號,24.988664,121.803389
32455,028129-3,320029,平鎮南勢郵局,桃園73支,桃園市,平鎮區,興安路120號,桃園市平鎮區興安路120號,24.917352,121.209133
32552,028130-5,320030,龍潭郵局,桃園74支,桃園市,龍潭區,中正路151號,桃園市龍潭區中正路151號,24.866668,121.216917
32547,028131-9,320031,龍潭大平郵局,桃園75支,桃園市,龍潭區,中正路三坑段743號,桃園市龍潭區中正路三坑段743號,24.831729,121.244306
32547,028132-2,320032,龍潭石門水庫郵局,桃園76支,桃園市,龍潭區,佳安路3號,桃園市龍潭區佳安路3號,24.834675,121.241109
32546,028133-6,320033,桃園客家文化館郵局,桃園77支,桃園市,龍潭區,中正路三林段500號,桃園市龍潭區中正路三林段500號,24.845481,121.234542
32551,028134-0,320034,龍潭中興郵局,桃園78支,桃園市,龍潭區,中興路280號,桃園市龍潭區中興路280號,24.874227,121.234081
32550,028136-7,320036,龍潭烏林郵局,桃園80支,桃園市,龍潭區,中豐路508號,桃園市龍潭區中豐路508號,24.88336,121.21217
32546,028137-1,320037,龍潭核研所郵局,桃園81支,桃園市,龍潭區,文化路1000號(行政院核能研究所內),桃園市龍潭區文化路1000號(行政院核能研究所內),24.85422,121.253261
32571,028138-4,320038,龍潭南龍郵局,桃園82支,桃園市,龍潭區,南龍路70號,桃園市龍潭區南龍路70號,24.863885,121.212224
32543,028139-8,320039,龍潭高原郵局,桃園83支,桃園市,龍潭區,中原路1段573號,桃園市龍潭區中原路1段573號,24.846288,121.198756
32643,028140-0,320040,楊梅郵局,桃園84支,桃園市,楊梅區,大平街7號,桃園市楊梅區大平街7號,24.910675,121.147608
32665,028141-3,320041,楊梅大同郵局,桃園85支,桃園市,楊梅區,中山北路1段168號,桃園市楊梅區中山北路1段168號,24.908057,121.153281
32649,028142-7,320042,楊梅富岡郵局,桃園86支,桃園市,楊梅區,富岡里中華街48號,桃園市楊梅區富岡里中華街48號,24.935099,121.081661
32654,028143-1,320043,楊梅埔心里郵局,桃園87支,桃園市,楊梅區,中興路25號,桃園市楊梅區中興路25號,24.918878,121.184212
32657,028144-4,320044,楊梅幼工郵局,桃園88支,桃園市,楊梅區,獅二路2號(幼獅工業區管理中心內),桃園市楊梅區獅二路2號(幼獅工業區管理中心內),24.926288,121.174512
32847,028145-8,320045,觀音草漯郵局,桃園89支,桃園市,觀音區,大觀路2段32之1號,桃園市觀音區大觀路2段32之1號,25.04809,121.143514
32661,028146-1,320046,楊梅高榮郵局,桃園90支,桃園市,楊梅區,電研路240號,桃園市楊梅區電研路240號,24.956351,121.167353
32643,028147-5,320047,楊梅光華郵局,桃園91支,桃園市,楊梅區,金德路51號,桃園市楊梅區金德路51號,24.916004,121.145876
32664,028148-9,320048,楊梅秀才郵局,桃園92支,桃園市,楊梅區,秀才路205號,桃園市楊梅區秀才路205號,24.901124,121.140858
32659,028149-2,320049,楊梅瑞塘郵局,桃園93支,桃園市,楊梅區,萬大路116巷46、48、50號1樓,桃園市楊梅區萬大路116巷46、48、50號1樓,24.909796,121.176567
73065,019100-1,730000,新營郵局,臺南65支,臺南市,新營區,中山路126號,臺南市新營區中山路126號,23.305143,120.317909
73048,019101-4,730001,新營新進路郵局,臺南66支,臺南市,新營區,新進路316號,臺南市新營區新進路316號,23.301473,120.315287
73047,019102-8,730002,新營民治路郵局,臺南67支,臺南市,新營區,民治路27-13號,臺南市新營區民治路27-13號,23.310789,120.31765
73663,019103-1,730003,柳營郵局,臺南68支,臺南市,柳營區,柳營路一段745號,臺南市柳營區柳營路一段745號,23.27402,120.313096
73049,019104-5,730004,新營民生郵局,臺南69支,臺南市,新營區,三民路180-3號,臺南市新營區三民路180-3號,23.305226,120.308293
73143,019105-9,730005,後壁郵局,臺南70支,臺南市,後壁區,後壁村1-15號,臺南市後壁區後壁村1-15號,23.365388,120.362622
73146,019106-2,730006,後壁菁寮郵局,臺南71支,臺南市,後壁區,菁寮里79-1號,臺南市後壁區菁寮里79-1號,23.37889,120.334811
73747,019107-6,730007,鹽水郵局,臺南72支,臺南市,鹽水區,中山路6號,臺南市鹽水區中山路6號,23.320138,120.267091
73062,019108-0,730008,新營太子宮郵局,臺南73支,臺南市,新營區,太北里9-5號,臺南市新營區太北里9-5號,23.294834,120.278987
73150,019109-3,730009,後壁安溪寮郵局,臺南74支,臺南市,後壁區,福安里下寮102-16號,臺南市後壁區福安里下寮102-16號,23.331001,120.354293
73742,019110-5,730010,鹽水茄苳腳郵局,臺南75支,臺南市,鹽水區,忠孝路54號,臺南市鹽水區忠孝路54號,23.310855,120.275145
73541,019111-9,730011,下營郵局,臺南76支,臺南市,下營區,慈惠街129號,臺南市下營區慈惠街129號,23.236085,120.26551
73443,019112-2,730012,六甲郵局,臺南77支,臺南市,六甲區,民生街2號,臺南市六甲區民生街2號,23.227133,120.351632
73242,019113-6,730013,白河郵局,臺南78支,臺南市,白河區,三民路410號,臺南市白河區三民路410號,23.351633,120.416252
73351,019114-0,730014,東山郵局,臺南79支,臺南市,東山區,東中里新東路1段18號,臺南市東山區東中里新東路1段18號,23.322858,120.402449
73256,019115-3,730015,白河內角郵局,臺南80支,臺南市,白河區,內角里24-1號,臺南市白河區內角里24-1號,23.398534,120.439088
73257,019116-7,730016,白河仙草埔郵局,臺南81支,臺南市,白河區,仙草里仙草63-1號,臺南市白河區仙草里仙草63-1號,23.343925,120.476351
73352,019117-1,730017,東山東原郵局,臺南82支,臺南市,東山區,東原里170號,臺南市東山區東原里170號,23.26562,120.444441
73659,019118-4,730018,柳營重溪郵局,臺南83支,臺南市,柳營區,重溪里12-4號,臺南市柳營區重溪里12-4號,23.287595,120.36617
73543,019119-8,730019,下營中營郵局,臺南84支,臺南市,下營區,中營里893號,臺南市下營區中營里893號,23.218541,120.277769
71241,019120-0,730020,新化郵局,臺南85支,臺南市,新化區,中正路312號,臺南市新化區中正路312號,23.032328,120.308798
74341,019121-3,730021,山上郵局,臺南86支,臺南市,山上區,山上里250號,臺南市山上區山上里250號,23.101268,120.355918
71341,019122-7,730022,左鎮郵局,臺南87支,臺南市,左鎮區,中正里15-3號,臺南市左鎮區中正里15-3號,23.058226,120.406233
71243,019123-1,730023,新化中山路郵局,臺南88支,臺南市,新化區,中山路320號,臺南市新化區中山路320號,23.036051,120.306832
71445,019124-4,730024,玉井郵局,臺南89支,臺南市,玉井區,中正路19號,臺南市玉井區中正路19號,23.122783,120.459487
71542,019125-8,730025,楠西郵局,臺南90支,臺南市,楠西區,東勢路117號,臺南市楠西區東勢路117號,23.177384,120.486101
71544,019126-1,730026,曾文水庫郵局,臺南91支,臺南市,楠西區,密枝里70號(曾文水庫管理局內),臺南市楠西區密枝里70號(曾文水庫管理局內),23.221147,120.498316
71642,019127-5,730027,南化郵局,臺南92支,臺南市,南化區,南化里115-11號,臺南市南化區南化里115-11號,23.043181,120.475918
72241,019128-9,730028,佳里郵局,臺南93支,臺南市,佳里區,延平路375號,臺南市佳里區延平路375號,23.163731,120.178129
72542,019129-2,730029,將軍郵局,臺南94支,臺南市,將軍區,西華里1-1號,臺南市將軍區西華里1-1號,23.19947,120.157186
72341,019130-4,730030,西港郵局,臺南95支,臺南市,西港區,中山路351號,臺南市西港區中山路351號,23.123459,120.202932
72441,019131-8,730031,七股郵局,臺南96支,臺南市,七股區,大埕里296號,臺南市七股區大埕里296號,23.143195,120.142405
42881,002228-2,400128,臺中中科郵局,臺中128支,臺中市,大雅區,中科路6號,臺中市大雅區中科路6號,24.209167,120.618669
82546,004263-5,800163,橋頭新市鎮郵局,高雄163支,高雄市,橋頭區,經武路911號,高雄市橋頭區經武路911號,22.738276,120.305154
72263,019132-1,730032,佳里佳里興郵局,臺南97支,臺南市,佳里區,興化里492-8號,臺南市佳里區興化里492-8號,23.189413,120.188174
72243,019133-5,730033,佳里中山路郵局,臺南98支,臺南市,佳里區,中山路141號,臺南市佳里區中山路141號,23.157358,120.177183
72742,019134-9,730034,北門郵局,臺南99支,臺南市,北門區,北門里舊埕91號,臺南市北門區北門里舊埕91號,23.267756,120.124709
72641,019135-2,730035,學甲郵局,臺南100支,臺南市,學甲區,中正路318號,臺南市學甲區中正路318號,23.235061,120.180886
72148,019136-6,730036,麻豆郵局,臺南101支,臺南市,麻豆區,興國路25號,臺南市麻豆區興國路25號,23.181748,120.248121
72153,019137-0,730037,麻豆總爺郵局,臺南102支,臺南市,麻豆區,南勢里106號,臺南市麻豆區南勢里106號,23.184141,120.267592
72143,019138-3,730038,麻豆新生郵局,臺南103支,臺南市,麻豆區,新生南路17號,臺南市麻豆區新生南路17號,23.184177,120.241313
74151,019139-7,730039,善化郵局,臺南104支,臺南市,善化區,中正路332號,臺南市善化區中正路332號,23.127206,120.294195
74247,019140-9,730040,大內郵局,臺南105支,臺南市,大內區,大內里7-2號,臺南市大內區大內里7-2號,23.118619,120.360232
74171,019141-2,730041,善化成功郵局,臺南106支,臺南市,善化區,成功路41號,臺南市善化區成功路41號,23.127537,120.317003
74443,019142-6,730042,新市大營郵局,臺南107支,臺南市,新市區,大營里131-18、131-19號,臺南市新市區大營里131-18、131-19號,23.092555,120.308918
74163,019143-0,730043,善化溪美郵局,臺南108支,臺南市,善化區,溪美里204號,臺南市善化區溪美里204號,23.152984,120.288447
74545,019144-3,730044,安定郵局,臺南109支,臺南市,安定區,保西里449號,臺南市安定區保西里449號,23.121858,120.236467
74441,019146-1,730046,新市郵局,臺南110支,臺南市,新市區,仁愛街217號,臺南市新市區仁愛街217號,23.07584,120.29339
72041,019147-4,730047,官田隆田郵局,臺南111支,臺南市,官田區,勝利路2號,臺南市官田區勝利路2號,23.193281,120.314566
72042,019149-1,730049,官田工業區郵局,臺南112支,臺南市,官田區,二鎮里工業路23號(官田工業區內),臺南市官田區二鎮里工業路23號(官田工業區內),23.210287,120.323272
74144,019150-3,730050,新市南科園區郵局,臺南113支,臺南市,新市區,南科六路6號,臺南市新市區南科六路6號,23.105887,120.280097
74157,019151-7,730051,善化中山路郵局,臺南114支,臺南市,善化區,中山路371號,臺南市善化區中山路371號,23.132167,120.292076
88041,024100-6,880000,馬公中正路郵局,澎湖901支,澎湖縣,馬公市,中正路70號,澎湖縣馬公市中正路70號,23.5671515,119.5635267
88049,024101-0,880001,馬公東文郵局,澎湖1支,澎湖縣,馬公市,東文里新店路465號1樓,澎湖縣馬公市東文里新店路465號1樓,23.5633957,119.5807472
88142,024102-3,880002,西嶼郵局,澎湖2支,澎湖縣,西嶼鄉,池東村212之1號,澎湖縣西嶼鄉池東村212之1號,23.599626,119.5087582
88241,024103-7,880003,望安郵局,澎湖3支,澎湖縣,望安鄉,東安村4之3號,澎湖縣望安鄉東安村4之3號,23.3593378,119.5053737
88341,024104-1,880004,七美郵局,澎湖4支,澎湖縣,七美鄉,海豐村10鄰19號,澎湖縣七美鄉海豐村10鄰19號,23.205437,119.4237901
88442,024105-4,880005,白沙郵局,澎湖5支,澎湖縣,白沙鄉,大赤崁356號,澎湖縣白沙鄉大赤崁356號,23.667237,119.5972901
88048,024106-8,880006,馬公中華路郵局,澎湖6支,澎湖縣,馬公市,中華路84號,澎湖縣馬公市中華路84號,23.570942,119.5704744
88541,024107-1,880007,湖西郵局,澎湖7支,澎湖縣,湖西鄉,湖西村77-11號,澎湖縣湖西鄉湖西村77-11號,23.5843522,119.654795
88055,024108-5,880008,馬公鎖港郵局,澎湖8支,澎湖縣,馬公市,鎖港里1483號,澎湖縣馬公市鎖港里1483號,23.5242261,119.5941904
88593,024109-9,880009,湖西隘門郵局,澎湖9支,澎湖縣,湖西鄉,隘門村27之1號,澎湖縣湖西鄉隘門村27之1號,23.5628501,119.6340054
95044,026100-9,950000,臺東大同路郵局,臺東901支,臺東縣,臺東市,大同路126號,臺東縣臺東市大同路126號,22.752944,121.153945
95241,026101-2,950001,蘭嶼郵局,臺東1支,臺東縣,蘭嶼鄉,紅頭村37號,臺東縣蘭嶼鄉紅頭村37號,22.025397,121.554155
