郵遞區號,電腦局號,郵務局號,局名,電腦局名,縣市,鄉鎮市區,地址,完整地址,緯度,經度
90061,007116-7,900016,屏東海豐郵局,屏東16支,屏東縣,屏東市,海豐街36-4號,屏東縣屏東市海豐街36-4號,22.700914,120.51085
90086,007117-1,900017,屏東公館郵局,屏東17支,屏東縣,屏東市,龍華路18號,屏東縣屏東市龍華路18號,22.638091,120.485071
90074,007118-4,900018,屏東中正路郵局,屏東18支,屏東縣,屏東市,中正路247號,屏東縣屏東市中正路247號,22.682128,120.491772
90059,007119-8,900019,屏東廣東路郵局,屏東19支,屏東縣,屏東市,廣東路458-5號,屏東縣屏東市廣東路458-5號,22.680462,120.501767
90063,007120-0,900020,屏東勝利路郵局,屏東20支,屏東縣,屏東市,勝利路123號,屏東縣屏東市勝利路123號,22.679355,120.485935
90076,007121-3,900021,屏東六塊厝郵局,屏東21支,屏東縣,屏東市,光復路304號,屏東縣屏東市光復路304號,22.669518,120.476493
90081,007122-7,900022,屏東厚生郵局,屏東22支,屏東縣,屏東市,建國路182號,屏東縣屏東市建國路182號,22.66549,120.478956
90841,007123-1,900023,長治繁華郵局,屏東23支,屏東縣,長治鄉,繁華村水源路90-1號,屏東縣長治鄉繁華村水源路90-1號,22.70218,120.573476
90088,007124-4,900024,屏東頭前溪郵局,屏東24支,屏東縣,屏東市,前進里清進巷79-6號,屏東縣屏東市前進里清進巷79-6號,22.648545,120.46471
90546,007126-1,900026,里港郵局,屏東26支,屏東縣,里港鄉,春林村中山南路40號,屏東縣里港鄉春林村中山南路40號,22.772778,120.494401
90544,007127-5,900027,里港三和路郵局,屏東27支,屏東縣,里港鄉,三廓村三和路127-1號,屏東縣里港鄉三廓村三和路127-1號,22.809934,120.502815
90641,007128-9,900028,高樹郵局,屏東28支,屏東縣,高樹鄉,高樹村興中路327號,屏東縣高樹鄉高樹村興中路327號,22.826522,120.600046
85191,007129-2,900029,茂林郵局,屏東29支,高雄市,茂林區,茂林里8-3號,高雄市茂林區茂林里8-3號,22.886564,120.664462
91341,007130-4,900030,萬丹郵局,屏東30支,屏東縣,萬丹鄉,萬全村萬丹路1段402號,屏東縣萬丹鄉萬全村萬丹路1段402號,22.591134,120.489141
90443,007131-8,900031,九如郵局,屏東31支,屏東縣,九如鄉,東寧路190號,屏東縣九如鄉東寧路190號,22.733733,120.490581
90745,007132-1,900032,鹽埔鹽中郵局,屏東32支,屏東縣,鹽埔鄉,鹽中村勝利路81-2號,屏東縣鹽埔鄉鹽中村勝利路81-2號,22.756521,120.575654
91241,007133-5,900033,內埔郵局,屏東33支,屏東縣,內埔鄉,內埔村文化路277號,屏東縣內埔鄉內埔村文化路277號,22.612448,120.567046
91245,007134-9,900034,內埔龍泉郵局,屏東34支,屏東縣,內埔鄉,龍潭村昭勝路265號,屏東縣內埔鄉龍潭村昭勝路265號,22.674705,120.600739
91250,007135-2,900035,內埔豐田郵局,屏東35支,屏東縣,內埔鄉,豐田村中正路310號,屏東縣內埔鄉豐田村中正路310號,22.631576,120.544112
91246,007136-6,900036,內埔建興郵局,屏東36支,屏東縣,內埔鄉,建興村100號(屏東榮家內),屏東縣內埔鄉建興村100號(屏東榮家內),22.65518,120.575397
91201,007137-0,900037,內埔學府郵局,屏東37支,屏東縣,內埔鄉,老埤村學府路1號(屏東科技大學內),屏東縣內埔鄉老埤村學府路1號(屏東科技大學內),22.644478,120.608668
91350,007138-3,900038,萬丹社皮郵局,屏東38支,屏東縣,萬丹鄉,社皮村大昌路471號,屏東縣萬丹鄉社皮村大昌路471號,22.615702,120.469783
94043,007139-7,900039,枋寮郵局,屏東39支,屏東縣,枋寮鄉,中山路194號,屏東縣枋寮鄉中山路194號,22.366449,120.595073
94041,007140-9,900040,枋寮水底寮郵局,屏東40支,屏東縣,枋寮鄉,中山路二段258號,屏東縣枋寮鄉中山路二段258號,22.385141,120.595164
94151,007141-2,900041,枋山郵局,屏東41支,屏東縣,枋山鄉,舊庄路47號,屏東縣枋山鄉舊庄路47號,22.198541,120.68967
94249,007142-6,900042,春日郵局,屏東42支,屏東縣,春日鄉,春日路13號,屏東縣春日鄉春日路13號,22.370353,120.624327
94642,007143-0,900043,恆春郵局,屏東43支,屏東縣,恆春鎮,恆西路1巷32號,屏東縣恆春鎮恆西路1巷32號,22.00177,120.742504
94644,007145-7,900045,恆春墾丁郵局,屏東45支,屏東縣,恆春鎮,恆西路1巷32號,屏東縣恆春鎮恆西路1巷32號,22.00177,120.742504
94643,007146-1,900046,恆春南門郵局,屏東46支,屏東縣,恆春鎮,中正路51號,屏東縣恆春鎮中正路51號,22.002671,120.74471
94441,007147-4,900047,車城郵局,屏東47支,屏東縣,車城鄉,福興村中山路54號,屏東縣車城鄉福興村中山路54號,22.073772,120.713836
94541,007148-8,900048,牡丹郵局,屏東48支,屏東縣,牡丹鄉,石門村石門路31-3號,屏東縣牡丹鄉石門村石門路31-3號,22.125315,120.773622
94741,007149-1,900049,滿州郵局,屏東49支,屏東縣,滿州鄉,中山路25號,屏東縣滿州鄉中山路25號,22.018249,120.838044
92043,007150-3,900050,潮州郵局,屏東50支,屏東縣,潮州鎮,光春路13號,屏東縣潮州鎮光春路13號,22.544773,120.537139
92046,007151-7,900051,潮州新生路郵局,屏東51支,屏東縣,潮州鎮,新生路115號,屏東縣潮州鎮新生路115號,22.55132,120.53859
92341,007152-1,900052,萬巒郵局,屏東52支,屏東縣,萬巒鄉,萬和村中正路10號,屏東縣萬巒鄉萬和村中正路10號,22.57129,120.56574
92141,007153-4,900053,泰武郵局,屏東53支,屏東縣,泰武鄉,佳平村佳平巷102號,屏東縣泰武鄉佳平村佳平巷102號,22.591558,120.631244
92241,007154-8,900054,來義郵局,屏東54支,屏東縣,來義鄉,古樓村中正路6號,屏東縣來義鄉古樓村中正路6號,22.5262,120.63564
92046,007155-1,900055,潮州南進路郵局,屏東55支,屏東縣,潮州鎮,長興路1-13、1-15號,屏東縣潮州鎮長興路1-13、1-15號,22.551149,120.543714
92641,007156-5,900056,南州郵局,屏東56支,屏東縣,南州鄉,仁里村三民路9號,屏東縣南州鄉仁里村三民路9號,22.489973,120.511038
92442,007157-9,900057,崁頂郵局,屏東57支,屏東縣,崁頂鄉,崁頂村中正路220號,屏東縣崁頂鄉崁頂村中正路220號,22.51455,120.513518
91144,007158-2,900058,竹田郵局,屏東58支,屏東縣,竹田鄉,竹田村中山路28號,屏東縣竹田鄉竹田村中山路28號,22.586577,120.542943
91142,007159-6,900059,竹田西勢郵局,屏東59支,屏東縣,竹田鄉,西勢村光明路12-1號,屏東縣竹田鄉西勢村光明路12-1號,22.619962,120.529291
92541,007160-8,900060,新埤郵局,屏東60支,屏東縣,新埤鄉,新埤村新華路123號,屏東縣新埤鄉新埤村新華路123號,22.468738,120.550943
92741,007161-1,900061,林邊郵局,屏東61支,屏東縣,林邊鄉,中林村中山路116號,屏東縣林邊鄉中林村中山路116號,22.433812,120.516267
93143,007162-5,900062,佳冬郵局,屏東62支,屏東縣,佳冬鄉,佳冬村佳和路86號,屏東縣佳冬鄉佳冬村佳和路86號,22.414375,120.552085
92843,007163-9,900063,東港中正路郵局,屏東63支,屏東縣,東港鎮,頂新里中正路183號,屏東縣東港鎮頂新里中正路183號,22.468981,120.450942
92849,007164-2,900064,東港郵局,屏東64支,屏東縣,東港鎮,光復路一段293號,屏東縣東港鎮光復路一段293號,22.469764,120.460154
93245,007165-6,900065,新園郵局,屏東65支,屏東縣,新園鄉,仙吉村仙吉路40號,屏東縣新園鄉仙吉村仙吉路40號,22.540613,120.460197
93241,007166-0,900066,新園烏龍郵局,屏東66支,屏東縣,新園鄉,中洲村南興路106號,屏東縣新園鄉中洲村南興路106號,22.485673,120.458612
92941,007167-3,900067,琉球郵局,屏東67支,屏東縣,琉球鄉,本福村中山路105號,屏東縣琉球鄉本福村中山路105號,22.351213,120.380779
50091,008100-7,500000,彰化中央路郵局,彰化901支,彰化縣,彰化市,中央路270號,彰化縣彰化市中央路270號,24.0682,120.527
50861,008101-1,500001,和美郵局,彰化1支,彰化縣,和美鎮,彰美路五段331號,彰化縣和美鎮彰美路五段331號,24.111178,120.499164
50341,008102-4,500002,花壇郵局,彰化2支,彰化縣,花壇鄉,中正路316號,彰化縣花壇鄉中正路316號,24.0257,120.539
50065,008103-8,500003,彰化府前郵局,彰化3支,彰化縣,彰化市,中山路二段377號,彰化縣彰化市中山路二段377號,24.075025,120.543898
50044,008104-1,500004,彰化市仔尾郵局,彰化4支,彰化縣,彰化市,中正路一段214號,彰化縣彰化市中正路一段214號,24.083928,120.547758
50062,008105-5,500005,彰化過溝仔郵局,彰化5支,彰化縣,彰化市,彰美路一段166號,彰化縣彰化市彰美路一段166號,24.088648,120.538174
50241,008106-9,500006,芬園郵局,彰化6支,彰化縣,芬園鄉,芬草路二段225號,彰化縣芬園鄉芬草路二段225號,24.013425,120.630604
50046,008107-2,500007,彰化西門郵局,彰化7支,彰化縣,彰化市,中華路369號,彰化縣彰化市中華路369號,24.075948,120.535729
50743,008108-6,500008,線西郵局,彰化8支,彰化縣,線西鄉,和線路949號,彰化縣線西鄉和線路949號,24.129997,120.470644
50081,008109-0,500009,彰化台化郵局,彰化9支,彰化縣,彰化市,中山路三段359號,彰化縣彰化市中山路三段359號,24.087266,120.562328
50842,008110-1,500010,和美中寮郵局,彰化10支,彰化縣,和美鎮,彰新路三段123、125號,彰化縣和美鎮彰新路三段123、125號,24.106431,120.530614
50063,008111-5,500011,彰化南瑤郵局,彰化11支,彰化縣,彰化市,中山路二段49號,彰化縣彰化市中山路二段49號,24.068265,120.540036
50077,008112-9,500012,彰化中庄仔郵局,彰化12支,彰化縣,彰化市,彰南路一段115號,彰化縣彰化市彰南路一段115號,24.087714,120.568013
50094,008113-2,500013,彰化南郭郵局,彰化13支,彰化縣,彰化市,介壽北路88號,彰化縣彰化市介壽北路88號,24.06905,120.547992
50007,008114-6,500014,彰化師大郵局,彰化14支,彰化縣,彰化市,進德路1號,彰化縣彰化市進德路1號,24.081164,120.559184
50091,008115-0,500015,彰化莿桐腳郵局,彰化15支,彰化縣,彰化市,彰水路35-7號,彰化縣彰化市彰水路35-7號,24.061874,120.519341
50448,008117-7,500017,秀水郵局,彰化17支,彰化縣,秀水鄉,彰水路二段583號,彰化縣秀水鄉彰水路二段583號,24.030665,120.496542
50941,008118-1,500018,伸港郵局,彰化18支,彰化縣,伸港鄉,中山路100號,彰化縣伸港鄉中山路100號,24.14693,120.484615
50048,008119-4,500019,彰化曉陽郵局,彰化19支,彰化縣,彰化市,民族路267號,彰化縣彰化市民族路267號,24.07194,120.539289
50066,008120-6,500020,彰化永安街郵局,彰化20支,彰化縣,彰化市,永安街198號,彰化縣彰化市永安街198號,24.087502,120.544671
50087,008121-0,500021,彰化大竹郵局,彰化21支,彰化縣,彰化市,彰南路二段209號,彰化縣彰化市彰南路二段209號,24.084915,120.58141
50971,008122-3,500022,伸港全興郵局,彰化22支,彰化縣,伸港鄉,興工路67號,彰化縣伸港鄉興工路67號,24.171531,120.510628
50061,008123-7,500023,彰化光復路郵局,彰化23支,彰化縣,彰化市,光復路130號,彰化縣彰化市光復路130號,24.08065,120.54059
51452,008124-1,500024,溪湖郵局,彰化24支,彰化縣,溪湖鎮,彰水路三段430號,彰化縣溪湖鎮彰水路三段430號,23.962688,120.480219
51641,008125-4,500025,埔鹽郵局,彰化25支,彰化縣,埔鹽鄉,彰水路二段100號,彰化縣埔鹽鄉彰水路二段100號,23.997675,120.477017
51450,008126-8,500026,溪湖湖西郵局,彰化26支,彰化縣,溪湖鎮,大公路34號,彰化縣溪湖鎮大公路34號,23.960421,120.47553
50571,008127-1,500027,鹿港郵局,彰化27支,彰化縣,鹿港鎮,成功路1號,彰化縣鹿港鎮成功路1號,24.055409,120.432606
50649,008128-5,500028,福興郵局,彰化28支,彰化縣,福興鄉,員鹿路二段184號,彰化縣福興鄉員鹿路二段184號,24.03963,120.436017
50543,008129-9,500029,鹿港頂番郵局,彰化29支,彰化縣,鹿港鎮,鹿和路四段147號,彰化縣鹿港鎮鹿和路四段147號,24.088042,120.482641
50544,008130-1,500030,鹿港彰濱郵局,彰化30支,彰化縣,鹿港鎮,鹿草路一段449號,彰化縣鹿港鎮鹿草路一段449號,24.065519,120.436023
50662,008131-4,500031,福興福工郵局,彰化31支,彰化縣,福興鄉,福工路1號,彰化縣福興鄉福工路1號,24.01174,120.487029
50541,008132-8,500032,鹿港草港郵局,彰化32支,彰化縣,鹿港鎮,頂草路四段406號,彰化縣鹿港鎮頂草路四段406號,24.108131,120.459394
52148,008133-1,500033,北斗郵局,彰化33支,彰化縣,北斗鎮,光復路226號,彰化縣北斗鎮光復路226號,23.87489,120.52429
52341,008134-5,500034,埤頭郵局,彰化34支,彰化縣,埤頭鄉,斗苑西路187號,彰化縣埤頭鄉斗苑西路187號,23.891342,120.460862
52241,008135-9,500035,田尾郵局,彰化35支,彰化縣,田尾鄉,光復路三段26號,彰化縣田尾鄉光復路三段26號,23.892398,120.52889
52342,008136-2,500036,埤頭路口厝郵局,彰化36支,彰化縣,埤頭鄉,溪林路273號,彰化縣埤頭鄉溪林路273號,23.846839,120.460647
52446,008137-6,500037,溪州郵局,彰化37支,彰化縣,溪州鄉,中央路三段321號,彰化縣溪州鄉中央路三段321號,23.851283,120.494745
52662,008138-0,500038,二林郵局,彰化38支,彰化縣,二林鎮,仁愛路707號,彰化縣二林鎮仁愛路707號,23.900791,120.364756
52773,008139-3,500039,大城郵局,彰化39支,彰化縣,大城鄉,北平路35號,彰化縣大城鄉北平路35號,23.856001,120.321688
52864,008140-5,500040,芳苑郵局,彰化40支,彰化縣,芳苑鄉,斗苑路芳苑段231號,彰化縣芳苑鄉斗苑路芳苑段231號,23.9247,120.31905
52541,008141-9,500041,竹塘郵局,彰化41支,彰化縣,竹塘鄉,竹林路一段366號,彰化縣竹塘鄉竹林路一段366號,23.86096,120.426964
52657,008142-2,500042,二林萬興郵局,彰化42支,彰化縣,二林鎮,二溪路六段290號,彰化縣二林鎮二溪路六段290號,23.954484,120.422885
52860,008143-6,500043,芳苑王功郵局,彰化43支,彰化縣,芳苑鄉,芳漢路王功段300、302號,彰化縣芳苑鄉芳漢路王功段300、302號,23.960818,120.337494
52858,008144-0,500044,芳苑草湖郵局,彰化44支,彰化縣,芳苑鄉,建平村二溪路草二段462號,彰化縣芳苑鄉建平村二溪路草二段462號,23.958081,120.382849
51044,008145-3,500045,員林郵局,彰化45支,彰化縣,員林市,員東路二段490號,彰化縣員林市員東路二段490號,23.957667,120.577349
51547,008146-7,500046,大村郵局,彰化46支,彰化縣,大村鄉,大溪路2號,彰化縣大村鄉大溪路2號,23.993927,120.544693
51347,008147-1,500047,埔心郵局,彰化47支,彰化縣,埔心鄉,忠義北路70號,彰化縣埔心鄉忠義北路70號,23.954156,120.54319
51061,008148-4,500048,員林員水路郵局,彰化48支,彰化縣,員林市,員水路一段338號,彰化縣員林市員水路一段338號,23.951286,120.597155
51050,008149-8,500049,員林三橋郵局,彰化49支,彰化縣,員林市,大同路二段137號,彰化縣員林市大同路二段137號,23.968903,120.575786
51048,008150-0,500050,員林西門郵局,彰化50支,彰化縣,員林市,新生路85號,彰化縣員林市新生路85號,23.95831,120.5686
51247,008151-3,500051,永靖郵局,彰化51支,彰化縣,永靖鄉,永靖街27號,彰化縣永靖鄉永靖街27號,23.920383,120.546814
51045,008152-7,500052,員林南門郵局,彰化52支,彰化縣,員林市,中正路63、65號,彰化縣員林市中正路63、65號,23.950803,120.575761
51346,008153-1,500053,埔心太平郵局,彰化53支,彰化縣,埔心鄉,中山路66、68號,彰化縣埔心鄉中山路66、68號,23.938795,120.559248
51041,008154-4,500054,員林中正路郵局,彰化54支,彰化縣,員林市,中正路457號,彰化縣員林市中正路457號,23.9585,120.57221
51147,008155-8,500055,社頭郵局,彰化55支,彰化縣,社頭鄉,員集路二段195號,彰化縣社頭鄉員集路二段195號,23.898206,120.587738
51151,008156-1,500056,社頭湳雅郵局,彰化56支,彰化縣,社頭鄉,山腳路三段325號,彰化縣社頭鄉山腳路三段325號,23.919227,120.604638
53043,008157-5,500057,二水郵局,彰化57支,彰化縣,二水鄉,員集路三段741號,彰化縣二水鄉員集路三段741號,23.811275,120.615522
52048,008158-9,500058,田中郵局,彰化58支,彰化縣,田中鎮,員集路二段305號,彰化縣田中鎮員集路二段305號,23.856875,120.585877
52044,008159-2,500059,田中內灣郵局,彰化59支,彰化縣,田中鎮,中南路二段430號,彰化縣田中鎮中南路二段430號,23.852796,120.605291
52047,008160-4,500060,田中三潭郵局,彰化60支,彰化縣,田中鎮,員集路二段616號,彰化縣田中鎮員集路二段616號,23.863606,120.58552
50853,008161-8,500061,和美道周郵局,彰化61支,彰化縣,和美鎮,山犁里道周路458、460號,彰化縣和美鎮山犁里道周路458、460號,24.108985,120.494406
97054,009100-3,970000,花蓮國安郵局,花蓮901支,花蓮縣,花蓮市,中山路408號,花蓮縣花蓮市中山路408號,23.984169,121.604241
97048,009101-7,970001,花蓮舊車站郵局,花蓮1支,花蓮縣,花蓮市,中山路92號,花蓮縣花蓮市中山路92號,23.975538,121.610828
97043,009102-1,970002,花蓮南京街郵局,花蓮2支,花蓮縣,花蓮市,南京街221號,花蓮縣花蓮市南京街221號,23.9753598,121.607365
97145,009104-8,970004,新城北埔郵局,花蓮4支,花蓮縣,新城鄉,大漢村光復路578號,花蓮縣新城鄉大漢村光復路578號,24.0324148,121.6040972
97253,009105-1,970005,秀林天祥郵局,花蓮5支,花蓮縣,秀林鄉,富世村天祥21號,花蓮縣秀林鄉富世村天祥21號,24.1830688,121.492748
97161,009106-5,970006,新城郵局,花蓮6支,花蓮縣,新城鄉,新城村中山路45號,花蓮縣新城鄉新城村中山路45號,24.1262761,121.6507232
97060,009107-9,970007,花蓮府前路郵局,花蓮7支,花蓮縣,花蓮市,府前路146號,花蓮縣花蓮市府前路146號,23.9905166,121.6196084
97365,009108-2,970008,吉安郵局,花蓮8支,花蓮縣,吉安鄉,慶豐村吉安路二段280號,花蓮縣吉安鄉慶豐村吉安路二段280號,23.9784239,121.564483
97063,009109-6,970009,花蓮下美崙郵局,花蓮9支,花蓮縣,花蓮市,民權路132號,花蓮縣花蓮市民權路132號,23.9937569,121.628923
97352,009110-8,970010,吉安仁里郵局,花蓮10支,花蓮縣,吉安鄉,仁里村中正路一段48號,花蓮縣吉安鄉仁里村中正路一段48號,23.9674879,121.590615
97059,009111-1,970011,花蓮港務局郵局,花蓮11支,花蓮縣,花蓮市,民權路27號,花蓮縣花蓮市民權路27號,23.9833389,121.619465
97291,009112-5,970012,秀林和平郵局,花蓮12支,花蓮縣,秀林鄉,和平村113號,花蓮縣秀林鄉和平村113號,24.2946066,121.4576376
97044,009113-9,970013,花蓮中華路郵局,花蓮13支,花蓮縣,花蓮市,中華路335-5號,花蓮縣花蓮市中華路335-5號,23.9747451,121.5948051
97068,009114-2,970014,花蓮富國路郵局,花蓮14支,花蓮縣,花蓮市,富國路52號,花蓮縣花蓮市富國路52號,23.9909145,121.5934609
97445,009115-6,970015,壽豐郵局,花蓮15支,花蓮縣,壽豐鄉,壽豐村中山路六段57號,花蓮縣壽豐鄉壽豐村中山路六段57號,23.8715054,121.5081741
97446,009116-0,970016,壽豐豐田郵局,花蓮16支,花蓮縣,壽豐鄉,豐山村中山路127巷16弄5號,花蓮縣壽豐鄉豐山村中山路127巷16弄5號,23.9058579,121.4919562
97441,009117-3,970017,壽豐志學郵局,花蓮17支,花蓮縣,壽豐鄉,志學村中山路二段202號,花蓮縣壽豐鄉志學村中山路二段202號,23.895711,121.527699
97342,009118-7,970018,吉安宜昌郵局,花蓮18支,花蓮縣,吉安鄉,中華路二段83號,花蓮縣吉安鄉中華路二段83號,23.9737598,121.5827421
97050,009119-1,970019,花蓮中山路郵局,花蓮19支,花蓮縣,花蓮市,中山路188號,花蓮縣花蓮市中山路188號,23.9783691,121.6062504
97064,009120-2,970020,花蓮師院郵局,花蓮20支,花蓮縣,花蓮市,華西路123號,花蓮縣花蓮市華西路123號,24.0102801,121.6158239
97368,009121-6,970021,吉安太昌郵局,花蓮21支,花蓮縣,吉安鄉,永安村吉安路一段35號,花蓮縣吉安鄉永安村吉安路一段35號,23.9916763,121.5730915
97545,009122-0,970022,鳳林郵局,花蓮22支,花蓮縣,鳳林鎮,光復路14號,花蓮縣鳳林鎮光復路14號,23.746051,121.447442
97543,009123-3,970023,鳳林萬榮郵局,花蓮23支,花蓮縣,鳳林鎮,長橋路133號,花蓮縣鳳林鎮長橋路133號,23.7130414,121.4186683
97542,009124-7,970024,鳳林林榮郵局,花蓮24支,花蓮縣,鳳林鎮,林榮路165號,花蓮縣鳳林鎮林榮路165號,23.8035431,121.4498689
97645,009125-1,970025,光復郵局,花蓮25支,花蓮縣,光復鄉,中正路一段124號,花蓮縣光復鄉中正路一段124號,23.6653316,121.4225043
97791,009127-8,970027,豐濱郵局,花蓮27支,花蓮縣,豐濱鄉,光豐路48號,花蓮縣豐濱鄉光豐路48號,23.601829,121.518307
97643,009128-1,970028,光復富田郵局,花蓮28支,花蓮縣,光復鄉,富田一街36號之1,花蓮縣光復鄉富田一街36號之1,23.6596132,121.4465216
97841,009129-5,970029,瑞穗郵局,花蓮29支,花蓮縣,瑞穗鄉,中山路一段120號,花蓮縣瑞穗鄉中山路一段120號,23.4968813,121.377605
97843,009130-7,970030,瑞穗富源郵局,花蓮30支,花蓮縣,瑞穗鄉,富源村中正路88號,花蓮縣瑞穗鄉富源村中正路88號,23.5788449,121.375961
98142,009131-1,970031,玉里郵局,花蓮31支,花蓮縣,玉里鎮,光復路111號,花蓮縣玉里鎮光復路111號,23.3310639,121.311727
98142,009132-4,970032,玉里泰昌郵局,花蓮32支,花蓮縣,玉里鎮,中山路二段139號,花蓮縣玉里鎮中山路二段139號,23.3357583,121.3117916
98249,009133-8,970033,卓溪郵局,花蓮33支,花蓮縣,卓溪鄉,中正路61-1號,花蓮縣卓溪鄉中正路61-1號,23.3328002,121.3137835
98191,009134-1,970034,玉里三民郵局,花蓮34支,花蓮縣,玉里鎮,三民里90-3號,花蓮縣玉里鎮三民里90-3號,23.4298744,121.3468298
98142,009135-5,970035,玉里新興郵局,花蓮35支,花蓮縣,玉里鎮,新興街91號,花蓮縣玉里鎮新興街91號,23.338844,121.31843
98341,009136-9,970036,富里郵局,花蓮36支,花蓮縣,富里鄉,中山路169號,花蓮縣富里鄉中山路169號,23.1765159,121.246053
98392,009137-2,970037,富里東里郵局,花蓮37支,花蓮縣,富里鄉,東里村道化路9號,花蓮縣富里鄉東里村道化路9號,23.2681358,121.3021328
97143,009138-6,970038,花蓮空軍基地郵局,花蓮38支,花蓮縣,新城鄉,嘉新村花師街37號,花蓮縣新城鄉嘉新村花師街37號,24.0164552,121.620775
97447,009139-0,970039,壽豐東華大學郵局,花蓮39支,花蓮縣,壽豐鄉,志學村大學路二段1號,花蓮縣壽豐鄉志學村大學路二段1號,23.8944766,121.5457334
26044,011100-0,260000,宜蘭中山路郵局,宜蘭901支,宜蘭縣,宜蘭市,中山路3段130號,宜蘭縣宜蘭市中山路3段130號,24.758323,121.753012
26051,011101-3,260001,宜蘭金六結郵局,宜蘭1支,宜蘭縣,宜蘭市,復興路3段100號,宜蘭縣宜蘭市復興路3段100號,24.751581,121.739136
26047,011102-7,260002,宜蘭渭水路郵局,宜蘭2支,宜蘭縣,宜蘭市,中山路2段275號,宜蘭縣宜蘭市中山路2段275號,24.753188,121.752568
26441,011103-1,260003,員山郵局,宜蘭3支,宜蘭縣,員山鄉,員山路1段299號,宜蘭縣員山鄉員山路1段299號,24.743924,121.724589
26444,011104-4,260004,員山內城郵局,宜蘭4支,宜蘭縣,員山鄉,榮光路353號,宜蘭縣員山鄉榮光路353號,24.72112,121.68815
26044,011105-8,260005,宜蘭西後街郵局,宜蘭5支,宜蘭縣,宜蘭市,西後街2-1號,宜蘭縣宜蘭市西後街2-1號,24.75542,121.751321
26344,011106-1,260006,壯圍郵局,宜蘭6支,宜蘭縣,壯圍鄉,壯五路327號,宜蘭縣壯圍鄉壯五路327號,24.746906,121.784349
26057,011108-9,260008,宜蘭東港路郵局,宜蘭8支,宜蘭縣,宜蘭市,東港路2段216號,宜蘭縣宜蘭市東港路2段216號,24.751998,121.765568
26054,011109-2,260009,宜蘭大坡路郵局,宜蘭9支,宜蘭縣,宜蘭市,大坡路2段225號,宜蘭縣宜蘭市大坡路2段225號,24.77946,121.740746
26047,011110-4,260010,宜蘭大學郵局,宜蘭10支,宜蘭縣,宜蘭市,神農路1段1號,宜蘭縣宜蘭市神農路1段1號,24.747809,121.745735
26144,011111-8,260011,頭城郵局,宜蘭11支,宜蘭縣,頭城鎮,民鋒路15號,宜蘭縣頭城鎮民鋒路15號,24.858517,121.823176
26145,011112-1,260012,頭城大溪港郵局,宜蘭12支,宜蘭縣,頭城鎮,濱海路5段153號,宜蘭縣頭城鎮濱海路5段153號,24.939446,121.891365
26147,011113-5,260013,頭城頂埔郵局,宜蘭13支,宜蘭縣,頭城鎮,青雲路2段299號,宜蘭縣頭城鎮青雲路2段299號,24.845451,121.807104
26243,011114-9,260014,礁溪郵局,宜蘭14支,宜蘭縣,礁溪鄉,礁溪路4段130號,宜蘭縣礁溪鄉礁溪路4段130號,24.821587,121.769941
26245,011115-2,260015,礁溪四城郵局,宜蘭15支,宜蘭縣,礁溪鄉,站前路19號,宜蘭縣礁溪鄉站前路19號,24.786977,121.76221
26242,011116-6,260016,礁溪湯仔城郵局,宜蘭16支,宜蘭縣,礁溪鄉,中山路2段196號,宜蘭縣礁溪鄉中山路2段196號,24.827307,121.774452
26060,011117-0,260017,宜蘭縣政府郵局,宜蘭17支,宜蘭縣,宜蘭市,縣政北路1號,宜蘭縣宜蘭市縣政北路1號,24.730606,121.76286
27041,011118-3,260018,蘇澳郵局,宜蘭18支,宜蘭縣,蘇澳鎮,中山路1段1號,宜蘭縣蘇澳鎮中山路1段1號,24.596114,121.853279
27042,011119-7,260019,蘇澳南方澳郵局,宜蘭19支,宜蘭縣,蘇澳鎮,江夏路13號,宜蘭縣蘇澳鎮江夏路13號,24.581706,121.86497
27047,011120-9,260020,蘇澳港邊里郵局,宜蘭20支,宜蘭縣,蘇澳鎮,蘇濱路1段301號,宜蘭縣蘇澳鎮蘇濱路1段301號,24.613042,121.849982
27050,011121-2,260021,蘇澳馬賽郵局,宜蘭21支,宜蘭縣,蘇澳鎮,大同路226號,宜蘭縣蘇澳鎮大同路226號,24.625723,121.833498
